{
  "$schema": "https://json-schema.org/draft/2020-12/schema",
  "$id": "context-pack.schema.json",
  "title": "ContextPack",
  "type": "object",
  "required": ["budget", "selected", "dropped", "totalTokens"],
  "properties": {
    "budget": {
      "type": "object",
      "required": ["maxTokens"],
      "properties": {
        "maxTokens": { "type": "integer" },
        "reserveTokens": { "type": "integer" }
      },
      "additionalProperties": false
    },
    "selected": {
      "type": "array",
      "items": { "$ref": "context-item.schema.json" }
    },
    "dropped": {
      "type": "array",
      "items": { "$ref": "context-item.schema.json" }
    },
    "totalTokens": { "type": "integer" },
    "stats": { "type": "object", "additionalProperties": true },
    "notes": { "type": "array", "items": { "type": "string" } }
  },
  "additionalProperties": true
}
